OSM_LU3,09-Jul-21,1735,RS SF,LU3_28,LU3_28,337,789,55.551544,-110.88773,LU3-28,lowland,Stand of confiers close to some aspen stands. Burrow ~15m down the trail?,Flat,0,600,5,N,3,7,"Parked just after bend in road, on the side.  Hiked along cut line (dry) and picked up game trail going into forest."
OSM_LU3,08-Jul-21,NA,RS SF,LU3_32,LU3_32,285,3995,55.40952,-111.20451,LU3-32,upland,In sparse forest w/ mossy understory facing well-defined game trail,Flat,0,710,4,NE,3,7,Take gravel road on E side of hwy 881 till just before gravel pit.  Camera is on S-side of road. Easy access through any part of forest.
OSM_LU3,10-Jul-21,NA,LKE MAY,LU3_36,LU3_36,140,1074,55.44786,-111.22414,LU3-36,upland,Primarily deciduous forest with large aspens and shorter spruce. Camera on poorly defined game trail with dense understory of grasses and aspen. Low canopy cover.,Flat,2,703,2,N,1,4,"Parked on side of road just outside of the CNRL security gate, then walked directly in towards site."
OSM_LU3,09-Jul-21,NA,LKE MAY,LU3_38,LU3_38,346,,55.44706,-110.76387,LU3-38,upland,"Black spruce stand, open area w/2 intersecting game trails (not very distinct), lots of labrador tea. Some ungulate trails",Flat,0,673,4,E,1,5,Parked on road side & followed some trails in. Camera placed on edge of cell to avoid being close to a JEM site.
OSM_LU3,10-Jul-21,NA,LKE MAY,LU3_39,LU3_39,149,1597,55.46641,-111.23818,LU3-39,upland,"Mixed aspen and spruce stand surrounded by well sites and clearcutes. Camera on poorly defined game trail. Understory of aspens, but mostly leafy debris. Lots of downed woody debris. ",Flat,0,687,3,N,1,6,Parked on nearest well site then walked east to forest stand. Accessed by following road straight after entering CNRL security gate. Fresh scat on trail directly in front of camera.
OSM_LU3,10-Jul-21,NA,LKE MAY,LU3_40,LU3_40,163,1281,55.47251,-111.16615,LU3-40,upland,"Wet, boggy area. Camera put in single patch of tamarack, area outside otherwise fairly treeless/has fairly short trees. Mossy understory with lots of bog plants. Very faint game trail on a cutline.",Flat,0,705,3,NE,1,7,"Enter CNRL Kirby gate, drive to last well pad & park to walk in. Camera just outside of cell because few spots for cameras. + have to move some other sites. Note: lock won't unlock - might need bolt cutters to remove."
OSM_LU3,10-Jul-21,NA,LKE MAY,LU3_41,LU3_41,629,"new SD, no number",55.46186,-111.16666,LU3-41,upland,"Grassy upland, dried bog surrounded by forest dominated by mixed aspen and spruce. Understory of rose and horsetails. Forest stand is surrounded by clear cuts.",Flat,0,732,2,E,1,5,"Parked at nearest well site, north of camera site. Walked west along cutline, southhwest of well site, then turned to enter huge cutblock to the south. Walked through cutblock to camera. Disturbed wasp nest and nearly got attacked, then sat on roses. Evil site based on longitude. Little animal sign, only poorly defined game trail"
OSM_LU3,10-Jul-21,1250,RS SF,LU3_44,LU3_44,171,4075,55.50131,-110.84864,LU3-44,upland,Camera in slightly open area - dry and mossy; stand of pine and spruce.,Slope,3,630,1,WSW,2,4,Parked on side of road and hiked in ~100m.
OSM_LU3,08-Jul-21,NA,LKE MAY,LU3_45,LU3_45,382,306,55.51747,-110.96503,LU3-45,lowland,Cutline adjacent heading to clearing. Forest dominated by black spruce. Fairly dry with mossy understory. Well-defined game trail.,Flat,0,697,2,NE,2,5,"Parked on road leading to Jackfish 3 plant. Walked in along cutline about 45 degree angle with the road, leading towards Jackfish plant. Following cutline to clearing w/ tall grass, then turn right. MOSQUITOS!"
OSM_LU3,09-Jul-21,NA,LKE MAY,LU3_46,LU3_46,105,1615,55.5084,-110.89555,LU3-46,upland,"Open, older black spruce forest - tall trees. Lots of aspen & labrador tea, mossy understory. Faint game trails through area. Bear scat seen on walk in.",Flat,0,626,5,E,NA,6,"Parked on roadside, walked into site along cutline."
OSM_LU3,08-Jul-21,NA,RS SF LKE MAY,LU3_48,LU3_48,577,520,55.54892,-111.09771,,lowland,"Dry sandy clearing with small, dense jack pine stands. Camera is above clearing with signs of random camping, about 30m away. Camera is on medium sized jackpine. Locked with A1 lock.",Flat,0,637,6,N,1,6,Drove down obvious cutline just west of main Jackfish plant access road. Walked north past pond/beaver dam into clearing. Locked with OSM A1 lock.
OSM_LU3,08-Jul-21,NA,LKE MAY,LU3_50,LU3_50,618,1534,55.55165,-111.03035,LU3-50,upland,Intersection of old cutline and diverging game trail. Aimed at 2 game trails diverging from one. Mixed aspen and black spruce forest. Labrador tea understory.,Flat,5,644,4,N,2,7,Parked on shoulder of main Jackfish road and walked straight in towards site; use main cutlines to walk along.
OSM_LU3,09-Jul-21,1243,RS SF,LU3_51,LU3_51,323,1453,55.55753,-110.82767,LU3-51,upland,Habitat edge between open meadow/shrubs and conifer forest.,Flat,0,600,1,NW,2,5,"Parked on side of road, walked E towards aspens/open meadow. Cutline running N-S at the center of open meadow w/ a solar panel."
OSM_LU3,09-Jul-21,NA,LKE MAY,LU3_52,LU3_52,627,514,55.56306,-110.89193,LU3-52,upland,"Open pine & aspen forest, taller trees, minimal understory. Game trail on old cutline. RT hawk in area that circled and hawked at us for ~10 mins.",Flat,0,586,5,NE,3,7,Parked at an oil pad off Cenovus roads (need to go through Cenovus gates). Don't actually park on or walk through the well pad. Walked in on an older road to the right of the well pad. Camera seems to have an issue with detections - was not taking many photos on set up - subject needs to be fairly close. (note 08/2021 from data entry: possibly due to extreme heat during deployment).
OSM_LU3,08-Jul-21,NA,RS SF LKE MAY,LU3_49,LU3_49,647,459,55.55693,-111.07931,LU3-49,lowland,Young aspen stand w/ lots of deadfall along old cutline. Located on an aspen facing deadfall that is lured. ,flat,3,650,5,SE,3,8,"Off hwy 881 onto industry road, pulled into old gravel pit w/ gate to park. Walk to the NE corner of pit and follow cutlines to camera. Large ungulate tracks in area."
